{
  "schemaVersion": 1,
  "revision": 1,
  "name": "example-team",
  "profiles": {
    "claude-current": { "provider": "claude", "command": ["claude"], "account": "current", "subscription": "User-selected Claude subscription", "model": null },
    "codex-current": { "provider": "codex", "command": ["codex"], "account": "current", "subscription": "User-selected Codex subscription", "model": null },
    "agy-oss": { "provider": "agy", "command": ["agy"], "account": "current", "subscription": "User-selected Agy subscription", "model": "gpt-oss-120b-medium" },
    "agy-pro": { "provider": "agy", "command": ["agy"], "account": "current", "subscription": "User-selected Agy subscription", "model": "gemini-3.1-pro-high" },
    "agy-flash": { "provider": "agy", "command": ["agy"], "account": "current", "subscription": "User-selected Agy subscription", "model": "gemini-3.8-flash-high" },
    "agy-sonnet": { "provider": "agy", "command": ["agy"], "account": "current", "subscription": "User-selected Agy subscription", "model": "claude-sonnet-4-6" },
    "agy-opus": { "provider": "agy", "command": ["agy"], "account": "current", "subscription": "User-selected Agy subscription", "model": "claude-opus-4-6-thinking" }
  },
  "roles": {
    "pm": { "parent": null, "profile": "claude-current", "concurrency": 1, "attempts": 1, "fallbacks": [] },
    "pl": { "parent": "pm", "profile": "codex-current", "concurrency": 1, "attempts": 1, "fallbacks": [] },
    "senior": { "parent": "pl", "profile": "agy-pro", "concurrency": 1, "attempts": 1, "fallbacks": ["agy-opus"] },
    "junior": { "parent": "pl", "profile": "agy-flash", "concurrency": 2, "attempts": 1, "fallbacks": ["agy-sonnet"] },
    "intern": { "parent": "junior", "profile": "agy-oss", "concurrency": 3, "attempts": 1, "fallbacks": ["agy-sonnet"] }
  },
  "policy": { "onExhaustion": "fallback", "maxCalls": 3, "timeoutMs": 300000, "repeatFailureLimit": 1 }
}
